{
  "templateSchemaVersion": "1.0.0",
  "id": "basic-cn-thesis",
  "name": "Basic CN Thesis",
  "version": "1.0.0",
  "locale": "zh-CN",
  "description": "Portable wrapper around the basic-cn-thesis format spec.",
  "school": "Example University",
  "college": "Example College",
  "degreeType": "bachelor",
  "tags": ["basic", "example"],
  "formatSpecRef": "format-spec.json",
  "variables": [],
  "assets": [],
  "pageTemplates": [],
  "complianceRules": [],
  "notes": ["Equivalent to examples/format-specs/basic-cn-thesis.json."]
}
